{
  "$schema": "https://json-schema.org/draft/2020-12/schema",
  "title": "Evidence Manifest",
  "type": "object",
  "required": ["manifest_id", "generated_at", "institution", "artifacts"],
  "properties": {
    "manifest_id": { "type": "string", "minLength": 1 },
    "generated_at": { "type": "string", "format": "date-time" },
    "institution": { "type": "string", "minLength": 1 },
    "artifacts": {
      "type": "array",
      "minItems": 1,
      "items": {
        "type": "object",
        "required": ["name", "location", "hash", "signature"],
        "properties": {
          "name": { "type": "string", "minLength": 1 },
          "location": { "type": "string", "minLength": 1 },
          "hash": { "type": "string", "minLength": 1 },
          "signature": { "type": "string", "minLength": 1 }
        },
        "additionalProperties": false
      }
    }
  },
  "additionalProperties": false
}
